{
  "schema_version": "1.0.0",
  "document_kind": "ai_asset_contract",
  "asset_id": "loot_container_derelict_v1",
  "category": "gameplay_prop",
  "gameplay_role": "searchable_loot_container",
  "dimensions_m": [0.9, 0.55, 0.65],
  "dimension_tolerance_m": 0.01,
  "pivot": "bottom_center",
  "forward_axis": "+Z",
  "allowed_yaw_deg": [0, 90, 180, 270],
  "required_states": ["closed", "open", "looted"],
  "state_derivation": "one_blender_master",
  "collision_owner": "godot_wrapper",
  "animation": {
    "kind": "hinge",
    "meshy_rigging_allowed": false,
    "rigging_target": "non_humanoid"
  },
  "budget": {
    "triangles": 3000,
    "material_slots": 2,
    "texture_resolution": 1024
  },
  "references": {
    "required_views": ["front", "side", "back", "three_quarter"],
    "input_layout": "separate_files",
    "rights_state": "project-owned"
  },
  "generation": {
    "provider": "meshy",
    "mode": "image_to_3d",
    "model_type": "smart-topology",
    "ai_model": "meshy-t2",
    "target_polycount": 3000,
    "should_texture": false,
    "candidate_count": 4,
    "target_formats": ["glb"]
  },
  "review": {
    "seeds": [42, 777],
    "lighting_modes": ["normal", "emergency", "dark"]
  },
  "prompt_profile": "synaptic_sea_derelict_v1",
  "visual_brief": "Derelict searchable loot container with a compact hinged metal case, readable latch, serviceable handles, and a clearly separable lid. Generate the closed master only; Blender derives the open and looted states and hinge."
}
