{
  "schema_version": "1.0.0",
  "document_kind": "ai_asset_contract",
  "asset_id": "hull_tendril_kit_v1",
  "category": "threat_kit",
  "gameplay_role": "segmented_hull_tendril_threat",
  "dimensions_m": [4.0, 1.5, 1.5],
  "dimension_tolerance_m": 0.02,
  "pivot": "bottom_center",
  "forward_axis": "+Z",
  "allowed_yaw_deg": [0, 90, 180, 270],
  "required_states": ["living", "severed"],
  "state_derivation": "one_blender_master",
  "collision_owner": "godot_wrapper",
  "animation": {
    "kind": "blender_segmented_chain_rig",
    "meshy_rigging_allowed": false,
    "rigging_target": "non_humanoid"
  },
  "budget": {
    "triangles": {
      "min": 1000,
      "max": 6000,
      "scope": "per_part"
    },
    "material_slots": 3,
    "texture_resolution": 1024
  },
  "references": {
    "required_views": ["front", "side", "back", "three_quarter"],
    "input_layout": "separate_files",
    "rights_state": "project-owned"
  },
  "generation": {
    "provider": "meshy",
    "mode": "image_to_3d",
    "model_type": "smart-topology",
    "ai_model": "meshy-t2",
    "target_polycount": 6000,
    "should_texture": false,
    "candidate_count": 3,
    "target_formats": ["glb"]
  },
  "review": {
    "seeds": [42, 777],
    "lighting_modes": ["normal", "emergency", "dark"]
  },
  "prompt_profile": "synaptic_sea_derelict_v1",
  "kit_parts": [
    "root",
    "trunk_module_a",
    "trunk_module_b",
    "trunk_module_c",
    "branch_a",
    "branch_b",
    "attack_tip",
    "severed_tip"
  ],
  "visual_brief": "Segmented Hull Tendril kit with one root, 2-3 trunk modules, two branches, an attack tip, and a severed tip. Blender owns the segmented-chain rig and derives living/severed states from one master; Meshy rigging is prohibited."
}
